{
  "$schema": "./document-model-json-schema.json",
  "id": "123e4567-e89b-12d3-a456-426614174000",
  "name": "My Test Document Model",
  "documentType": "my-org/test",
  "fileExtension": ".test",
  "state": {
    "global": {
      "globalStuff": []
    },
    "other": {
      "id": "other",
      "ids": []
    }
  }
}